Tipe,Urutan,Nama
Prosedur,1,Memakai handscoon.
Prosedur,2,Memposisikan pasien terlentang.
Prosedur,3,Pada pasien tanpa kecurigaan cidera cervical dilakukan maneuver head tilt–chin lift, sedangkan pada kasus trauma dengan cidera cervical dilakukan manuver jaw thrust dengan mencegah tidak stabilnya tulang leher.
Prosedur,4,Head tilt–chin lift maneuver: Posisikan telapak tangan pada dahi sambil mendorong dahi ke dalam, pada waktu bersamaan ujung tangan lain mengangkat dagu.
Prosedur,5,Pertahankan maneuver untuk menjaga jalan napas tetap terbuka.
